{"schema":"drawtonomy-planning-trace-v1","producer":{"name":"sut/aeb","version":"1.1"},"frame":"ref","tracks":[{"role":"ego","vehicle":{"length":5.04,"width":2.0,"refToCenter":1.4},"driven":[{"t":0.0,"x":50.0,"y":-5.25,"h":0.0,"v":25.0},{"t":0.04,"x":51.0,"y":-5.25,"h":0.0,"v":25.0},{"t":0.08,"x":52.0,"y":-5.25,"h":0.0,"v":25.0},{"t":0.12,"x":53.0,"y":-5.25,"h":0.0,"v":25.0},{"t":0.16,"x":54.0,"y":-5.25,"h":0.0,"v":25.0},{"t":0.2,"x":55.0,"y":-5.25,"h":0.0,"v":25.0},{"t":0.24,"x":56.0,"y":-5.25,"h":0.0,"v":25.0},{"t":0.28,"x":57.0,"y":-5.25,"h":0.0,"v":25.0},{"t":0.32,"x":58.0,"y":-5.25,"h":0.0,"v":25.0},{"t":0.36,"x":59.0,"y":-5.25,"h":0.0,"v":25.0},{"t":0.4,"x":60.0,"y":-5.25,"h":0.0,"v":25.0},{"t":0.44,"x":61.0,"y":-5.25,"h":0.0,"v":25.0},{"t":0.48,"x":62.0,"y":-5.25,"h":0.0,"v":25.0},{"t":0.52,"x":63.0,"y":-5.25,"h":0.0,"v":25.0},{"t":0.56,"x":64.0,"y":-5.25,"h":0.0,"v":25.0},{"t":0.6,"x":65.0,"y":-5.25,"h":0.0,"v":25.0},{"t":0.64,"x":66.0,"y":-5.25,"h":0.0,"v":25.0},{"t":0.68,"x":67.0,"y":-5.25,"h":0.0,"v":25.0},{"t":0.72,"x":68.0,"y":-5.25,"h":0.0,"v":25.0},{"t":0.76,"x":69.0,"y":-5.25,"h":0.0,"v":25.0},{"t":0.8,"x":70.0,"y":-5.25,"h":0.0,"v":25.0},{"t":0.84,"x":71.0,"y":-5.25,"h":0.0,"v":25.0},{"t":0.88,"x":72.0,"y":-5.25,"h":0.0,"v":25.0},{"t":0.92,"x":73.0,"y":-5.25,"h":0.0,"v":25.0},{"t":0.96,"x":74.0,"y":-5.25,"h":0.0,"v":25.0},{"t":1.0,"x":75.0,"y":-5.25,"h":0.0,"v":25.0},{"t":1.04,"x":76.0,"y":-5.25,"h":0.0,"v":25.0},{"t":1.08,"x":77.0,"y":-5.25,"h":0.0,"v":25.0},{"t":1.12,"x":78.0,"y":-5.25,"h":0.0,"v":25.0},{"t":1.16,"x":79.0,"y":-5.25,"h":0.0,"v":25.0},{"t":1.2,"x":80.0,"y":-5.25,"h":0.0,"v":25.0},{"t":1.24,"x":81.0,"y":-5.25,"h":0.0,"v":25.0},{"t":1.28,"x":82.0,"y":-5.25,"h":0.0,"v":25.0},{"t":1.32,"x":83.0,"y":-5.25,"h":0.0,"v":25.0},{"t":1.36,"x":84.0,"y":-5.25,"h":0.0,"v":25.0},{"t":1.4,"x":85.0,"y":-5.25,"h":0.0,"v":25.0},{"t":1.44,"x":86.0,"y":-5.25,"h":0.0,"v":25.0},{"t":1.48,"x":87.0,"y":-5.25,"h":0.0,"v":25.0},{"t":1.52,"x":88.0,"y":-5.25,"h":0.0,"v":25.0},{"t":1.56,"x":89.0,"y":-5.25,"h":0.0,"v":25.0},{"t":1.6,"x":90.0,"y":-5.25,"h":0.0,"v":25.0},{"t":1.64,"x":91.0,"y":-5.25,"h":0.0,"v":25.0},{"t":1.68,"x":92.0,"y":-5.25,"h":0.0,"v":25.0},{"t":1.72,"x":93.0,"y":-5.25,"h":0.0,"v":25.0},{"t":1.76,"x":94.0,"y":-5.25,"h":0.0,"v":25.0},{"t":1.8,"x":95.0,"y":-5.25,"h":0.0,"v":25.0},{"t":1.84,"x":96.0,"y":-5.25,"h":0.0,"v":25.0},{"t":1.88,"x":97.0,"y":-5.25,"h":0.0,"v":25.0},{"t":1.92,"x":98.0,"y":-5.25,"h":0.0,"v":25.0},{"t":1.96,"x":99.0,"y":-5.25,"h":0.0,"v":25.0},{"t":2.0,"x":100.0,"y":-5.25,"h":0.0,"v":25.0},{"t":2.04,"x":101.0,"y":-5.25,"h":0.0,"v":25.0},{"t":2.08,"x":102.0,"y":-5.25,"h":0.0,"v":25.0},{"t":2.12,"x":103.0,"y":-5.25,"h":0.0,"v":25.0},{"t":2.16,"x":104.0,"y":-5.25,"h":0.0,"v":25.0},{"t":2.2,"x":105.0,"y":-5.25,"h":0.0,"v":25.0},{"t":2.24,"x":106.0,"y":-5.25,"h":0.0,"v":25.0},{"t":2.28,"x":107.0,"y":-5.25,"h":0.0,"v":25.0},{"t":2.32,"x":108.0,"y":-5.25,"h":0.0,"v":25.0},{"t":2.36,"x":109.0,"y":-5.25,"h":0.0,"v":25.0},{"t":2.4,"x":110.0,"y":-5.25,"h":0.0,"v":25.0},{"t":2.44,"x":111.0,"y":-5.25,"h":0.0,"v":25.0},{"t":2.48,"x":112.0,"y":-5.25,"h":0.0,"v":25.0},{"t":2.52,"x":113.0,"y":-5.25,"h":0.0,"v":25.0},{"t":2.56,"x":114.0,"y":-5.25,"h":0.0,"v":25.0},{"t":2.6,"x":115.0,"y":-5.25,"h":0.0,"v":25.0},{"t":2.64,"x":116.0,"y":-5.25,"h":0.0,"v":25.0},{"t":2.68,"x":117.0,"y":-5.25,"h":0.0,"v":25.0},{"t":2.72,"x":118.0,"y":-5.25,"h":0.0,"v":25.0},{"t":2.76,"x":119.0,"y":-5.25,"h":0.0,"v":25.0},{"t":2.8,"x":120.0,"y":-5.25,"h":0.0,"v":25.0},{"t":2.84,"x":121.0,"y":-5.25,"h":0.0,"v":25.0},{"t":2.88,"x":122.0,"y":-5.25,"h":0.0,"v":25.0},{"t":2.92,"x":123.0,"y":-5.25,"h":0.0,"v":25.0},{"t":2.96,"x":124.0,"y":-5.25,"h":0.0,"v":25.0},{"t":3.0,"x":125.0,"y":-5.25,"h":0.0,"v":25.0},{"t":3.04,"x":126.0,"y":-5.25,"h":0.0,"v":25.0},{"t":3.08,"x":127.0,"y":-5.25,"h":0.0,"v":25.0},{"t":3.12,"x":128.0,"y":-5.25,"h":0.0,"v":25.0},{"t":3.16,"x":129.0,"y":-5.25,"h":0.0,"v":25.0},{"t":3.2,"x":130.0,"y":-5.25,"h":0.0,"v":25.0},{"t":3.24,"x":131.0,"y":-5.25,"h":0.0,"v":25.0},{"t":3.28,"x":132.0,"y":-5.25,"h":0.0,"v":25.0},{"t":3.32,"x":133.0,"y":-5.25,"h":0.0,"v":25.0},{"t":3.36,"x":134.0,"y":-5.25,"h":0.0,"v":25.0},{"t":3.4,"x":135.0,"y":-5.25,"h":0.0,"v":25.0},{"t":3.44,"x":136.0,"y":-5.25,"h":0.0,"v":25.0},{"t":3.48,"x":137.0,"y":-5.25,"h":0.0,"v":25.0},{"t":3.52,"x":138.0,"y":-5.25,"h":0.0,"v":25.0},{"t":3.56,"x":139.0,"y":-5.25,"h":0.0,"v":25.0},{"t":3.6,"x":140.0,"y":-5.25,"h":0.0,"v":25.0},{"t":3.64,"x":141.0,"y":-5.25,"h":0.0,"v":25.0},{"t":3.68,"x":142.0,"y":-5.25,"h":0.0,"v":25.0},{"t":3.72,"x":143.0,"y":-5.25,"h":0.0,"v":25.0},{"t":3.76,"x":144.0,"y":-5.25,"h":0.0,"v":25.0},{"t":3.8,"x":145.0,"y":-5.25,"h":0.0,"v":25.0},{"t":3.84,"x":146.0,"y":-5.25,"h":0.0,"v":25.0},{"t":3.88,"x":147.0,"y":-5.25,"h":0.0,"v":25.0},{"t":3.92,"x":148.0,"y":-5.25,"h":0.0,"v":25.0},{"t":3.96,"x":149.0,"y":-5.25,"h":0.0,"v":25.0},{"t":4.0,"x":150.0,"y":-5.25,"h":0.0,"v":24.976},{"t":4.04,"x":150.998,"y":-5.25,"h":0.0,"v":24.92},{"t":4.08,"x":151.993,"y":-5.25,"h":0.0,"v":24.832},{"t":4.12,"x":152.984,"y":-5.25,"h":0.0,"v":24.712},{"t":4.16,"x":153.969,"y":-5.25,"h":0.0,"v":24.56},{"t":4.2,"x":154.948,"y":-5.25,"h":0.0,"v":24.382},{"t":4.24,"x":155.92,"y":-5.25,"h":0.0,"v":24.202},{"t":4.28,"x":156.884,"y":-5.25,"h":0.0,"v":24.022},{"t":4.32,"x":157.841,"y":-5.25,"h":0.0,"v":23.842},{"t":4.36,"x":158.792,"y":-5.25,"h":0.0,"v":23.662},{"t":4.4,"x":159.734,"y":-5.25,"h":0.0,"v":23.482},{"t":4.44,"x":160.67,"y":-5.25,"h":0.0,"v":23.302},{"t":4.48,"x":161.599,"y":-5.25,"h":0.0,"v":23.122},{"t":4.52,"x":162.52,"y":-5.25,"h":0.0,"v":22.942},{"t":4.56,"x":163.434,"y":-5.25,"h":0.0,"v":22.762},{"t":4.6,"x":164.341,"y":-5.25,"h":0.0,"v":22.582},{"t":4.64,"x":165.24,"y":-5.25,"h":0.0,"v":22.402},{"t":4.68,"x":166.133,"y":-5.25,"h":0.0,"v":22.222},{"t":4.72,"x":167.018,"y":-5.25,"h":0.0,"v":22.042},{"t":4.76,"x":167.896,"y":-5.25,"h":0.0,"v":21.862},{"t":4.8,"x":168.767,"y":-5.25,"h":0.0,"v":21.682},{"t":4.84,"x":169.631,"y":-5.25,"h":0.0,"v":21.502},{"t":4.88,"x":170.487,"y":-5.25,"h":0.0,"v":21.322},{"t":4.92,"x":171.337,"y":-5.25,"h":0.0,"v":21.142},{"t":4.96,"x":172.179,"y":-5.25,"h":0.0,"v":20.962},{"t":5.0,"x":173.014,"y":-5.25,"h":0.0,"v":20.782},{"t":5.04,"x":173.841,"y":-5.25,"h":0.0,"v":20.602},{"t":5.08,"x":174.662,"y":-5.25,"h":0.0,"v":20.422},{"t":5.12,"x":175.475,"y":-5.25,"h":0.0,"v":20.242},{"t":5.16,"x":176.281,"y":-5.25,"h":0.0,"v":20.062},{"t":5.2,"x":177.08,"y":-5.25,"h":0.0,"v":19.882},{"t":5.24,"x":177.872,"y":-5.25,"h":0.0,"v":19.702},{"t":5.28,"x":178.656,"y":-5.25,"h":0.0,"v":19.522},{"t":5.32,"x":179.434,"y":-5.25,"h":0.0,"v":19.342},{"t":5.36,"x":180.204,"y":-5.25,"h":0.0,"v":19.162},{"t":5.4,"x":180.966,"y":-5.25,"h":0.0,"v":18.982},{"t":5.44,"x":181.722,"y":-5.25,"h":0.0,"v":18.802},{"t":5.48,"x":182.471,"y":-5.25,"h":0.0,"v":18.622},{"t":5.52,"x":183.212,"y":-5.25,"h":0.0,"v":18.442},{"t":5.56,"x":183.946,"y":-5.25,"h":0.0,"v":18.262},{"t":5.6,"x":184.673,"y":-5.25,"h":0.0,"v":18.082},{"t":5.64,"x":185.393,"y":-5.25,"h":0.0,"v":17.902},{"t":5.68,"x":186.105,"y":-5.25,"h":0.0,"v":17.722},{"t":5.72,"x":186.81,"y":-5.25,"h":0.0,"v":17.542},{"t":5.76,"x":187.508,"y":-5.25,"h":0.0,"v":17.362},{"t":5.8,"x":188.199,"y":-5.25,"h":0.0,"v":17.182},{"t":5.84,"x":188.883,"y":-5.25,"h":0.0,"v":17.002},{"t":5.88,"x":189.559,"y":-5.25,"h":0.0,"v":16.822},{"t":5.92,"x":190.229,"y":-5.25,"h":0.0,"v":16.642},{"t":5.96,"x":190.891,"y":-5.25,"h":0.0,"v":16.462},{"t":6.0,"x":191.546,"y":-5.25,"h":0.0,"v":16.282},{"t":6.04,"x":192.193,"y":-5.25,"h":0.0,"v":16.102},{"t":6.08,"x":192.834,"y":-5.25,"h":0.0,"v":15.922},{"t":6.12,"x":193.467,"y":-5.25,"h":0.0,"v":15.742},{"t":6.16,"x":194.093,"y":-5.25,"h":0.0,"v":15.562},{"t":6.2,"x":194.712,"y":-5.25,"h":0.0,"v":15.382},{"t":6.24,"x":195.324,"y":-5.25,"h":0.0,"v":15.202},{"t":6.28,"x":195.928,"y":-5.25,"h":0.0,"v":15.022},{"t":6.32,"x":196.525,"y":-5.25,"h":0.0,"v":14.842},{"t":6.36,"x":197.116,"y":-5.25,"h":0.0,"v":14.662},{"t":6.4,"x":197.698,"y":-5.25,"h":0.0,"v":14.482},{"t":6.44,"x":198.274,"y":-5.25,"h":0.0,"v":14.302},{"t":6.48,"x":198.843,"y":-5.25,"h":0.0,"v":14.122},{"t":6.52,"x":199.404,"y":-5.25,"h":0.0,"v":13.942},{"t":6.56,"x":199.958,"y":-5.25,"h":0.0,"v":13.762},{"t":6.6,"x":200.505,"y":-5.25,"h":0.0,"v":13.582},{"t":6.64,"x":201.044,"y":-5.25,"h":0.0,"v":13.402},{"t":6.68,"x":201.577,"y":-5.25,"h":0.0,"v":13.222},{"t":6.72,"x":202.102,"y":-5.25,"h":0.0,"v":13.042},{"t":6.76,"x":202.62,"y":-5.25,"h":0.0,"v":12.862},{"t":6.8,"x":203.131,"y":-5.25,"h":0.0,"v":12.682},{"t":6.84,"x":203.635,"y":-5.25,"h":0.0,"v":12.502},{"t":6.88,"x":204.131,"y":-5.25,"h":0.0,"v":12.322},{"t":6.92,"x":204.621,"y":-5.25,"h":0.0,"v":12.142},{"t":6.96,"x":205.103,"y":-5.25,"h":0.0,"v":11.962},{"t":7.0,"x":205.578,"y":-5.25,"h":0.0,"v":11.782},{"t":7.04,"x":206.045,"y":-5.25,"h":0.0,"v":11.602},{"t":7.08,"x":206.506,"y":-5.25,"h":0.0,"v":11.422},{"t":7.12,"x":206.959,"y":-5.25,"h":0.0,"v":11.242},{"t":7.16,"x":207.405,"y":-5.25,"h":0.0,"v":11.062},{"t":7.2,"x":207.844,"y":-5.25,"h":0.0,"v":10.882},{"t":7.24,"x":208.276,"y":-5.25,"h":0.0,"v":10.702},{"t":7.28,"x":208.7,"y":-5.25,"h":0.0,"v":10.522},{"t":7.32,"x":209.118,"y":-5.25,"h":0.0,"v":10.342},{"t":7.36,"x":209.528,"y":-5.25,"h":0.0,"v":10.162},{"t":7.4,"x":209.93,"y":-5.25,"h":0.0,"v":9.982},{"t":7.44,"x":210.326,"y":-5.25,"h":0.0,"v":9.802},{"t":7.48,"x":210.715,"y":-5.25,"h":0.0,"v":9.622},{"t":7.52,"x":211.096,"y":-5.25,"h":0.0,"v":9.442},{"t":7.56,"x":211.47,"y":-5.25,"h":0.0,"v":9.262},{"t":7.6,"x":211.837,"y":-5.25,"h":0.0,"v":9.082},{"t":7.64,"x":212.196,"y":-5.25,"h":0.0,"v":8.902},{"t":7.68,"x":212.549,"y":-5.25,"h":0.0,"v":8.722},{"t":7.72,"x":212.894,"y":-5.25,"h":0.0,"v":8.542},{"t":7.76,"x":213.232,"y":-5.25,"h":0.0,"v":8.362},{"t":7.8,"x":213.563,"y":-5.25,"h":0.0,"v":8.182},{"t":7.84,"x":213.887,"y":-5.25,"h":0.0,"v":8.002},{"t":7.88,"x":214.203,"y":-5.25,"h":0.0,"v":7.822},{"t":7.92,"x":214.513,"y":-5.25